{
  "$schema": "../../../../../.cursor/skills/cads-parity-qa/visual-recipe.schema.json",
  "schemaVersion": 1,
  "component": "ComponentName",
  "figma": {
    "fileKey": "DGekOeToRVifvFAhfqpeC1",
    "publicNodeId": "0000:0000",
    "componentKey": "",
    "relatedNodeIds": [],
    "retrievedAt": "YYYY-MM-DD",
    "designContextCaptured": false
  },
  "change": {
    "taskPath": "new",
    "previousRecipe": null,
    "figmaChanges": []
  },
  "axes": {
    "public": {},
    "designOnly": [],
    "restrictedCombinations": []
  },
  "geometry": {
    "sizes": {},
    "layout": {
      "padding": "",
      "gap": "",
      "borderWidth": "",
      "radius": "",
      "overlap": ""
    },
    "typography": {
      "family": "",
      "size": "",
      "weight": "",
      "lineHeight": ""
    },
    "icon": {
      "family": "",
      "size": ""
    }
  },
  "recipes": [
    {
      "when": {
        "variant": "default",
        "color": "default",
        "state": "default",
        "mode": "light"
      },
      "variables": {
        "background": "",
        "border": "",
        "text": "",
        "icon": "",
        "focus": ""
      },
      "geometryOverrides": {},
      "figmaVariant": "",
      "notes": []
    }
  ],
  "coverage": {
    "strategy": "pairwise-plus-risk",
    "requiredDimensions": [],
    "cases": [
      {
        "id": "component-default-light",
        "figmaNodeId": "0000:0000",
        "figmaVariant": "",
        "mode": "light",
        "props": {},
        "state": "default",
        "viewport": {
          "width": 320,
          "height": 160,
          "deviceScaleFactor": 1
        },
        "expectedGeometry": {},
        "expectedVariables": [],
        "fixturePath": "",
        "referenceScreenshot": "",
        "browserScreenshot": "",
        "result": "pending",
        "mismatches": []
      }
    ]
  },
  "acceptedDifferences": [],
  "evidence": {
    "apiAudit": null,
    "typecheck": null,
    "build": null,
    "docsBuild": null,
    "correctionPasses": []
  }
}
